Career,Description,Qualification,Skills,Interest,Hobby
Video Game Writer,"Creates narratives for games","Bachelor's in Creative Writing","Storytelling, Game design","Writing, Gaming","Creative writing, Gaming"
Wind Turbine Technician,"Maintains wind energy systems","Technical certificate","Electrical systems, Height safety","Renewable energy, Technology","Rock climbing, Sustainability projects"
Xenobotany Researcher,"Studies extraterrestrial plant potential","PhD in Botany + Astrobiology","Plant physiology, Space agriculture","Plants, Space","Astronomy, Greenhouse gardening"
Yacht Designer,"Creates boat designs","Bachelor's in Naval Architecture","Hydrodynamics, CAD","Marine engineering, Design","Sailing, Model shipbuilding"
Zincography Specialist,"Uses zinc plate printing techniques","Art school training","Printmaking, Chemical processing","Art, Chemistry","Print art, Chemical experiments"
AI Policy Advisor,"Develops regulations for AI","JD in Tech Policy / PhD in Tech Policy","Policy analysis, Tech forecasting","Law, Technology","Tech ethics, Policy writing"
Blockchain Legal Expert,"Specializes in crypto law","Blockchain Certification","Smart contract law, Regulations","Law, Technology","Crypto projects, Legal blogging"
Cosmetic Chemist,"Develops personal care products","Bachelor's in Chemistry","Formulation, Safety testing","Chemistry, Beauty","DIY cosmetics, Safety standards"
Dark Sky Advocate,"Promotes light pollution reduction","Environmental Science degree","Lighting design, Public outreach","Astronomy, Conservation","Stargazing, Astronomy outreach"
Electromagnetic Field Specialist,"Studies EM field effects","Master's in Physics","EMF measurement, Mitigation","Physics, Health","EMF testing, Electronics"
Food Stylist,"Prepares food for photography","Culinary arts training","Food presentation, Photography","Food, Art","Cooking, Photography"
Gemological Scientist,"Analyzes gemstones","Graduate Gemologist cert","Gem identification, Spectroscopy","Geology, Chemistry","Mineral collecting, Spectroscopy"
Horticultural Therapist,"Uses plants for therapy","Horticultural therapy cert","Plant care, Therapeutic techniques","Nature, Wellness","Gardening, Therapy techniques"
Industrial Psychologist,"Applies psychology to workplaces","PhD in Industrial Psychology","Organizational assessment, Training","Psychology, Business","Workplace surveys, Coaching"
Jazz Musician,"Performs jazz music","Music degree","Improvisation, Music theory","Music, Creativity","Jamming, Music composition"
Kinetic Sculptor,"Creates moving art installations","MFA in Sculpture","Mechanics, Welding","Art, Engineering","Sculpture, Mechanical projects"
Luthier,"Builds/repairs string instruments","Apprenticeship","Woodworking, Acoustics","Craftsmanship, Music","Instrument making, Music performance"
Mycologist,"Studies fungi","PhD in Mycology","Fungal cultivation, Identification","Biology, Nature","Mushroom foraging, Cultivation"
Neonatal Nurse Practitioner,"Specializes in newborn care","Master's in Nursing + Neonatal Cert","Neonatal resuscitation, Developmental care","Healthcare, Pediatrics","Childcare advocacy, Parenting education"
Oenologist,"Studies wine and winemaking","Degree in Enology","Wine tasting, Fermentation","Chemistry, Agriculture","Wine tasting, Viticulture"
Packaging Designer,"Creates product packaging","Bachelor's in Packaging Design","Structural design, Branding","Design, Marketing","Model making, Brand development"
Quantum Cryptographer,"Develops quantum-secure encryption","PhD in Quantum Computing","Quantum key distribution, Algorithms","Mathematics, Security","Cryptography, Puzzle solving"
Radiopharmacist,"Prepares radioactive pharmaceuticals","PharmD + Radiopharmacy Cert","Radiation safety, Radiochemistry","Pharmacy, Nuclear medicine","Chemistry experiments, Safety protocols"
Sustainable Architect,"Designs eco-friendly buildings","Bachelor's in Architecture","Green building standards, Energy modeling","Sustainability, Design","Green building tours, Energy auditing"
Tissue Engineer,"Creates artificial tissues","PhD in Tissue Engineering","Biomaterials, Cell culture","Biotechnology, Medicine","3D bioprinting, Medical research"
Underwater Welder,"Performs welding underwater","Commercial diving + welding certs","Diving, Welding","Adventure, Technical work","Scuba diving, Metalworking"
Voice User Interface Designer,"Designs voice-controlled systems","Bachelor's in UX Design","Conversational design, NLP","Technology, Linguistics","Voice app development, Language study"
Wind Energy Analyst,"Assesses wind power potential","Bachelor's in Energy Engineering","Wind modeling, Data analysis","Renewable energy, Analytics","Weather tracking, Data visualization"
Xylographer,"Creates woodblock prints","Art school training","Wood carving, Printing","Art, Craftsmanship","Woodworking, Printmaking"
Youth Climate Activist,"Advocates for climate action","Environmental Studies","Public speaking, Campaigning","Environment, Social justice","Community organizing, Climate strikes"
Zymurgist,"Studies fermentation processes","Degree in Fermentation Science","Microbiology, Biochemistry","Food science, Chemistry","Brewing, Fermentation experiments"