Career,Description,Qualification,Skills,Interest,Hobby
Software Engineer,"Designs, develops, and tests software applications","Bachelor's in Computer Science","Programming, Algorithms, Debugging","Technology, Problem-solving","Coding side projects"
Registered Nurse,"Provides patient care in healthcare settings","Bachelor of Science in Nursing","Patient assessment, Medication administration","Helping others, Medicine","Health blogging, Yoga"
Graphic Designer,"Creates visual concepts for communications","Bachelor's in Graphic Design","Adobe Creative Suite, Typography","Creativity, Art","Digital illustration, Photography"
Data Analyst,"Interprets complex data to inform decisions","Bachelor's in Statistics","Excel, SQL, Data visualization","Analytics, Patterns","Puzzle games, Data competitions"
Elementary Teacher,"Educates children in foundational subjects","Bachelor's in Education + Teaching License","Curriculum planning, Classroom management","Teaching, Child development","Educational blogging, Tutoring"
Civil Engineer,"Designs infrastructure projects","Bachelor's in Civil Engineering","CAD, Structural analysis","Problem-solving, Design","Model building, Urban exploration"
Marketing Manager,"Develops promotional strategies","Bachelor's in Marketing","Market research, Digital marketing","Consumer behavior, Creativity","Social media trends, Blogging"
Financial Advisor,"Provides financial planning services","Bachelor's in Finance","Financial planning, Risk assessment","Numbers, Economics","Stock tracking, Personal finance"
Mechanical Engineer,"Designs mechanical systems","Bachelor's in Mechanical Engineering","Thermodynamics, CAD","Innovation, Physics","Robotics, 3D printing"
Psychologist,"Studies mental processes and behavior","Doctorate in Psychology","Counseling, Research methods","Human behavior, Helping others","Journaling, Meditation"
Chef,"Oversees kitchen operations","Culinary School Diploma","Knife skills, Menu planning","Food science, Creativity","Recipe development, Food blogging"
Electrician,"Installs/maintains electrical systems","Apprenticeship + License","Electrical codes, Troubleshooting","Practical work, Problem-solving","Home automation, Electronics"
Web Developer,"Builds and maintains websites","Associate's in CS / Bachelor's in CS","HTML/CSS, JavaScript","Technology, Design","Web design contests, Coding"
Physical Therapist,"Helps patients regain mobility","Doctor of Physical Therapy","Rehabilitation techniques, Anatomy","Health sciences, Helping others","Fitness training, Yoga"
Accountant,"Manages financial records","Bachelor's in Accounting","Bookkeeping, Tax preparation","Numbers, Organization","Personal budgeting, Tax volunteering"
Architect,"Designs buildings and structures","Bachelor's in Architecture","Revit, Building codes","Design, Spatial reasoning","Architectural sketching, Model making"
Dental Hygienist,"Provides preventive dental care","Associate's in Dental Hygiene","Teeth cleaning, X-rays","Oral health, Detail orientation","Dental health education, Nutrition"
Human Resources Manager,"Oversees employee relations","Bachelor's in HR Management","Recruitment, Conflict resolution","Psychology, Communication","Career coaching, Networking"
Biomedical Scientist,"Conducts medical research","PhD in Biomedical Science","Lab techniques, Data analysis","Research, Biology","Science podcasts, Medical volunteering"
Environmental Scientist,"Studies environmental issues","Bachelor's in Environmental Science","GIS, Data collection","Nature, Sustainability","Hiking, Conservation"
Pharmacy Technician,"Assists pharmacists","High school Diploma","Prescription processing, Inventory","Healthcare, Precision","Medication management, Health apps"
Veterinarian,"Treats animal illnesses","Doctor of Veterinary Medicine","Animal diagnosis, Surgery","Animal welfare, Biology","Pet fostering, Wildlife rehab"
Social Media Manager,"Manages online presence","Bachelor's in Communications","Content creation, Analytics","Trends, Creativity","Blogging, Photography"
Paralegal,"Supports legal professionals","Associate's in Paralegal Studies","Legal research, Document drafting","Law, Research","Mock trials, Legal blogging"
Industrial Designer,"Develops product designs","Bachelor's in Industrial Design","3D modeling, Prototyping","Creativity, Ergonomics","Sketching, DIY projects"
Aerospace Engineer,"Designs aircraft/spacecraft","Bachelor's in Aerospace Eng","Aerodynamics, MATLAB","Space, Physics","Flight simulators, Astronomy"
Technical Writer,"Creates technical documentation","Bachelor's in Technical Writing","Technical communication, Editing","Writing, Technology","Documentation projects, Blogging"
Occupational Therapist,"Helps patients with daily activities","Master's in Occupational Therapy","Adaptive strategies, Rehabilitation","Helping others, Health sciences","Therapeutic crafts, Adaptive sports"
Market Research Analyst,"Studies market conditions","Bachelor's in Marketing / Bachelor's in Stats","Survey design, Data analysis","Consumer behavior, Trends","Data visualization, Survey creation"
Dentist,"Diagnoses/treats dental issues","Doctor of Dental Surgery","Dental procedures, Patient care","Oral health, Precision","Dental health workshops, Cooking"
Event Planner,"Coordinates events","Bachelor's in Hospitality","Vendor management, Logistics","Organization, Creativity","Party planning, Community events"
Economist,"Studies economic trends","Master's in Economics","Statistical analysis, Modeling","Economics, Research","Economic forecasting, Policy debates"
Forensic Scientist,"Analyzes crime scene evidence","Bachelor's in Forensic Science","DNA analysis, Microscopy","Science, Detail orientation","True crime podcasts, Puzzles"
Urban Planner,"Develops land use plans","Master's in Urban Planning","GIS, Zoning laws","Sustainability, Design","City simulation games, Hiking"
Robotics Engineer,"Designs robotic systems","Bachelor's in Robotics Eng","ROS, Control systems","Automation, Innovation","Robot competitions, Electronics"
Cybersecurity Analyst,"Protects computer systems","Bachelor's in Cybersecurity","Network security, Ethical hacking","Technology, Security","CTF competitions, Security blogs"
Librarian,"Manages information resources","Master's in Library Science","Cataloging, Research assistance","Literature, Organization","Book clubs, Reading"
Physical Trainer,"Designs fitness programs","Certification by NASM","Exercise programming, Anatomy","Fitness, Health","Weightlifting, Marathon running"
Real Estate Agent,"Assists with property transactions","High school diploma + Real Estate License","Property valuation, Negotiation","Sales, Architecture","Home staging, Community tours"
Speech-Language Pathologist,"Treats communication disorders","Master's in Speech Pathology","Therapy techniques, Diagnostics","Language, Healthcare","Podcasting, Linguistics"
Biologist,"Studies living organisms","Bachelor's in Biology","Field research, Lab work","Nature, Science","Birdwatching, Microscopy"
Chemist,"Analyzes substances","Bachelor's in Chemistry","Chemical analysis, Lab safety","Science, Research","Home experiments, Science kits"
Geologist,"Studies Earth materials","Bachelor's in Geology","Mineral identification, Mapping","Nature, Science","Rock collecting, Hiking"
Meteorologist,"Forecasts weather","Bachelor's in Meteorology","Weather modeling, Data analysis","Science, Patterns","Storm chasing, Weather apps"
Animator,"Creates animated content","Bachelor's in Animation","2D/3D animation, Storyboarding","Art, Storytelling","Sketching, Cartooning"
Interpreter,"Translates spoken language","Certification","Fluency in languages, Cultural knowledge","Languages, Communication","Language exchange, Travel"
Commercial Pilot,"Operates aircraft","Commercial Pilot License","Flight navigation, Safety protocols","Aviation, Travel","Flight simulation, Aircraft spotting"
Court Reporter,"Creates legal transcripts","Certification program","Stenography, Legal terminology","Law, Detail orientation","Transcription practice, Legal dramas"
Genetic Counselor,"Assesses genetic risks","Master's in Genetic Counseling","Genetic testing interpretation, Counseling","Healthcare, Ethics","Ancestry research, Medical ethics"
Marine Biologist,"Studies ocean life","Bachelor's in Marine Biology","SCUBA certification, Species ID","Ocean conservation, Science","Scuba diving, Marine photography"
Phlebotomist,"Draws blood samples","Phlebotomy certification","Venipuncture, Specimen handling","Healthcare, Precision","First aid training, Medical volunteering"
Radiologic Technologist,"Operates medical imaging equipment","Associate's in Radiography","X-ray operation, Patient safety","Healthcare, Technology","Medical technology blogs, Photography"
Sound Engineer,"Records and mixes audio","Certificate in Audio Eng /Bachelor's in Audio Eng","Audio mixing, Acoustics","Music, Technology","Music production, Concert sound"
Technical Support Specialist,"Resolves tech issues","Associate's in IT","Troubleshooting, Customer service","Technology, Helping others","Computer building, Tech forums"
Travel Agent,"Plans travel itineraries","High school diploma + Training","Itinerary planning, Customer service","Travel, Geography","Travel blogging, Culture exploration"
Veterinary Technician,"Assists veterinarians","Associate's in Vet Tech","Animal handling, Lab tests","Animal care, Biology","Pet fostering, Wildlife rehab"
Web Designer,"Creates website layouts","Associate's in Design / Bachelor's in Design","UI/UX design, Wireframing","Creativity, Technology","Web design contests, Digital art"
Welder,"Joins metal components","Vocational training + Certification","Welding techniques, Blueprint reading","Practical work, Precision","Metalworking, Sculpture"
Youth Counselor,"Supports young people","Bachelor's in Psychology/Counseling","Active listening, Crisis intervention","Helping others, Psychology","Mentoring, Community service"
Zoologist,"Studies animal behavior","Bachelor's in Zoology","Animal observation, Data collection","Animal welfare, Science","Wildlife photography, Nature hikes"
Database Administrator,"Manages database systems","Bachelor's in CS / Bachelor's in IT","SQL, Database security","Technology, Organization","Data modeling, Puzzle solving"
Ethical Hacker,"Tests security systems","Cybersecurity certifications","Penetration testing, Vulnerability assessment","Technology, Problem-solving","Security blogs, Coding"
Fitness Instructor,"Leads exercise classes","Certification by ACE","Group instruction, Exercise science","Fitness, Motivation","Group workouts, Nutrition planning"
Forester,"Manages forest resources","Bachelor's in Forestry","Conservation planning, GIS","Nature, Conservation","Hiking, Tree identification"
Game Developer,"Creates video games","Bachelor's in Game Development","Game engines, Programming","Technology, Creativity","Gaming, Game modding"
Historian,"Researches past events","Master's in History","Research, Archival work","History, Culture","Museum visits, Historical reenactment"
Industrial Engineer,"Optimizes production systems","Bachelor's in Industrial Eng","Process improvement, Systems analysis","Efficiency, Problem-solving","Process mapping, DIY"
Journalist,"Researches and reports news","Bachelor's in Journalism","Interviewing, Fact-checking","Current events, Writing","Blogging, Photography"
Kindergarten Teacher,"Educates young children","Bachelor's in Early Childhood Ed","Child development, Creative teaching","Teaching, Child psychology","Crafts, Storytelling"
Landscape Architect,"Designs outdoor spaces","Bachelor's in Landscape Arch","Horticulture, Site planning","Design, Nature","Gardening, Botanical sketching"
Massage Therapist,"Provides therapeutic massage","Massage therapy license","Anatomy knowledge, Techniques","Wellness, Helping others","Aromatherapy, Yoga"
Music Teacher,"Teaches music skills","Bachelor's in Music Education","Instrument instruction, Music theory","Music, Teaching","Performing, Music composition"
Nutritionist,"Advises on dietary health","Bachelor's in Nutrition","Dietary planning, Nutrition science","Health, Food science","Cooking, Nutrition blogging"
Operations Manager,"Oversees business operations","Bachelor's in Business Admin","Process optimization, Leadership","Management, Efficiency","Business podcasts, Process mapping"
Paramedic,"Provides emergency medical care","Paramedic certification","Emergency response, Medical procedures","Healthcare, Crisis management","First aid training, Fitness"
Personal Trainer,"Develops fitness programs","Certification by ACSM","Exercise programming, Motivation","Fitness, Health","Weightlifting, Nutrition tracking"
Quality Assurance Analyst,"Tests software quality","Bachelor's in CS","Testing methodologies, Bug tracking","Detail orientation, Technology","Beta testing, Tech reviews"
Radiologist,"Interprets medical images","Medical degree + Residency","Medical imaging analysis, Diagnosis","Medicine, Technology","Medical journals, Diagnostic puzzles"
Solar Technician,"Installs solar energy systems","Vocational training","Photovoltaic systems, Electrical","Renewable energy, Technology","DIY solar projects, Sustainability"
Technical Sales Engineer,"Sells technical products","Bachelor's in Engineering","Technical knowledge, Sales","Technology, Persuasion","Tech demos, Product reviews"
UX Designer,"Designs user experiences","Bachelor's in Design / Bachelor's in CS","User research, Wireframing","Psychology, Technology","Usability testing, Design thinking"
Video Producer,"Creates video content","Bachelor's in Film / Bachelor's in Production","Editing, Cinematography","Storytelling, Creativity","Filmmaking, Photography"
Wildlife Biologist,"Studies wild animals","Bachelor's in Wildlife Biology","Field research, Species tracking","Animal conservation, Science","Wildlife photography, Hiking"
X-Ray Technician,"Operates X-ray equipment","Associate's in Radiologic Tech","Radiation safety, Imaging","Healthcare, Technology","Medical technology, Photography"
Yoga Instructor,"Leads yoga practices","Yoga certification","Asana instruction, Breathing techniques","Wellness, Mindfulness","Meditation, Fitness"
Zookeeper,"Cares for zoo animals","Bachelor's in Zoology","Animal care, Habitat maintenance","Animal welfare, Biology","Animal volunteering, Nature doc"
AI Specialist,"Develops artificial intelligence","Master's in CS / Master's in AI","Machine learning, Neural networks","Technology, Research","AI projects, Robotics"
Blockchain Developer,"Builds decentralized applications","Bachelor's in CS","Smart contracts, Cryptography","Technology, Finance","Crypto projects, Coding"
Cloud Architect,"Designs cloud solutions","Bachelor's in CS + Certifications","Cloud platforms, Infrastructure","Technology, Architecture","Cloud labs, System design"
Data Scientist,"Extracts insights from data","Master's in Data Science","Machine learning, Statistical modeling","Analytics, Problem-solving","Kaggle competitions, Coding"
Environmental Engineer,"Solves environmental problems","Bachelor's in Environmental Eng","Pollution control, Sustainability","Ecology, Problem-solving","Gardening, Conservation"
Financial Analyst,"Assesses financial performance","Bachelor's in Finance","Financial modeling, Excel","Numbers, Analysis","Stock market, Portfolio management"
Geneticist,"Studies genes and heredity","PhD in Genetics","DNA sequencing, Research","Biology, Research","Science communication, Genealogy"
Augmented Reality Designer,"Creates AR experiences for various industries","Bachelor's in Digital Design","3D Modeling, Spatial Computing","Technology, Creativity","VR development, Digital art"
Bioinformatician,"Analyzes biological data using computational tools","Master's in Bioinformatics","Python, Genomics, Data Mining","Biology, Technology","Science blogging, Data visualization"
Chief Sustainability Officer,"Leads corporate environmental initiatives","MBA + Sustainability Cert","Strategic planning, ESG reporting","Environment, Leadership","Gardening, Climate activism"
Clinical Research Coordinator,"Manages clinical trial operations","Bachelor's in Life Sciences","Protocol development, Regulatory compliance","Research, Healthcare","Medical writing, Volunteering"
Cognitive Neuroscientist,"Studies brain mechanisms of cognition","PhD in Neuroscience","fMRI Analysis, Experimental Design","Research, Psychology","Brain games, Science communication"
Cryptocurrency Analyst,"Evaluates digital currency markets","Bachelor's in Finance","Blockchain analysis, Market forecasting","Finance, Technology","Crypto mining, Trading simulations"
Cybersecurity Consultant,"Advises organizations on security measures","Bachelor's in IT + CISSP","Risk assessment, Security frameworks","Technology, Problem-solving","Security blogs, Capture The Flag"
Data Privacy Officer,"Ensures compliance with data regulations","JD in Privacy Law or Master's in Privacy Law","GDPR, CCPA, Policy development","Law, Technology","Privacy advocacy, Policy analysis"
Digital Archivist,"Preserves digital content for future access","Master's in Library Science","Metadata standards, Digital preservation","History, Organization","Digitization projects, Genealogy"
Drone Operator,"Controls UAVs for commercial applications","FAA Part 107 Certification","Aerial navigation, Photography","Technology, Aviation","Drone racing, Aerial photography"
E-Commerce Specialist,"Manages online sales platforms","Bachelor's in Marketing","SEO, Digital analytics","Business, Technology","Online selling, Market research"
Educational Technologist,"Integrates technology in learning environments","Master's in EdTech","Learning management systems, Instructional design","Education, Technology","App development, Online tutoring"
Ethical AI Auditor,"Assesses AI systems for bias and fairness","Master's in Ethics / Master's in CS","Algorithm auditing, Bias detection","Technology, Social justice","Debate, Ethics case studies"
Forensic Accountant,"Investigates financial fraud","CPA + CFE Certification","Fraud examination, Financial analysis","Numbers, Investigation","Financial puzzles, True crime"
Genetic Engineer,"Modifies organisms at genetic level","PhD in Genetic Engineering","CRISPR, Gene editing","Biotechnology, Research","Science experiments, Biohacking"
Geriatric Care Manager,"Coordinates care for elderly clients","Master's in Social Work","Care planning, Elder law","Helping others, Healthcare","Senior volunteering, Health advocacy"
Health Informatics Specialist,"Manages healthcare data systems","Master's in Health Informatics","EMR systems, Data security","Healthcare, Technology","Health apps, Data analysis"
Hydroponics Farmer,"Grows plants without soil","Agriculture training","Nutrient management, System maintenance","Sustainability, Biology","Gardening, Sustainability blogs"
Industrial Hygienist,"Identifies workplace health hazards","Bachelor's in Occupational Health","Toxicology, Risk assessment","Safety, Science","Safety training, Environmental monitoring"
IoT Solutions Architect,"Designs connected device ecosystems","Bachelor's in Computer Engineering","Sensor networks, Cloud integration","Technology, Innovation","Smart home projects, Coding"
Language Localization Specialist,"Adapts content for global audiences","Bachelor's in Linguistics","Cultural adaptation, Translation","Languages, Communication","Travel, Language learning"
Marine Conservationist,"Protects ocean ecosystems","Bachelor's in Marine Science","Ecosystem monitoring, Policy advocacy","Conservation, Biology","Scuba diving, Beach cleanups"
Medical Illustrator,"Creates visual medical content","Bachelor's in Medical Illustration","Anatomical drawing, 3D modeling","Art, Medicine","Scientific sketching, Animation"
Nanotechnology Engineer,"Works with materials at molecular scale","PhD in Nanotechnology","Nanofabrication, Materials science","Research, Innovation","Microscopy, Science experiments"
Opera Singer,"Performs in operatic productions","Music Conservatory Training","Vocal technique, Stage presence","Music, Performing arts","Voice training, Theater"
Paleontologist,"Studies fossilized remains","PhD in Paleontology","Fossil analysis, Field excavation","History, Science","Museum visits, Fossil hunting"
Quantum Computing Researcher,"Develops quantum algorithms","PhD in Physics / PhD in CS","Quantum mechanics, Algorithm design","Physics, Mathematics","Quantum simulations, Puzzle solving"
Renewable Energy Engineer,"Designs sustainable energy systems","Bachelor's in Energy Engineering","Solar/Wind technology, Grid integration","Sustainability, Technology","DIY solar projects, Energy monitoring"
Robotics Technician,"Maintains robotic systems","Associate's in Robotics","Robot programming, Maintenance","Technology, Problem-solving","Drone building, Electronics"
Sports Statistician,"Analyzes athletic performance data","Bachelor's in Statistics","Data modeling, Performance metrics","Sports, Analytics","Fantasy sports, Data visualization"
Telehealth Coordinator,"Manages virtual healthcare services","Bachelor's in Healthcare Admin","Platform management, Patient scheduling","Healthcare, Technology","Health apps, System optimization"
User Research Specialist,"Studies user behaviors for product design","Master's in Human Factors","Usability testing, Interviewing","Psychology, Technology","People watching, Survey design"
Virtual Reality Developer,"Creates immersive VR environments","Bachelor's in CS / Bachelor's in Design","Unity, 3D modeling","Technology, Creativity","VR gaming, Environment design"
Wilderness Guide,"Leads outdoor expeditions","Wilderness First Responder Cert","Navigation, Survival skills","Nature, Adventure","Hiking, Camping"
Xenolinguist,"Studies potential alien languages","PhD in Linguistics + Astrobiology","Linguistic theory, Speculative communication","Languages, Space","Sci-fi, Language creation"
Youth Sports Coordinator,"Organizes athletic programs for youth","Bachelor's in Sports Management","Program development, Coaching","Sports, Education","Coaching, Community events"
Zoological Veterinarian,"Specializes in exotic animal care","DVM + Zoo Medicine Residency","Exotic animal medicine, Conservation","Animal welfare, Biology","Wildlife rehab, Conservation"
Accessibility Consultant,"Ensures products/services are inclusive","Certified Professional in Accessibility","WCAG standards, Universal design","Inclusion, Technology","Advocacy, Inclusive design"
Behavioral Economist,"Studies psychological factors in economics","PhD in Behavioral Economics","Experimental design, Data analysis","Psychology, Economics","Behavior experiments, Policy analysis"
Culinary Scientist,"Applies science to food development","Master's in Food Science","Food chemistry, Sensory analysis","Food, Science","Molecular gastronomy, Recipe testing"
Digital Forensics Expert,"Investigates cyber crimes","Bachelor's in Cybersecurity","Data recovery, Evidence handling","Technology, Investigation","Security puzzles, True crime"
Ecological Modeler,"Simulates environmental systems","PhD in Ecology","Mathematical modeling, GIS","Nature, Mathematics","Data visualization, Hiking"
Fashion Technologist,"Integrates tech into clothing","Bachelor's in Fashion Tech","Smart textiles, Wearable tech","Fashion, Technology","E-textiles, Fashion design"
Geoarchaeologist,"Studies archaeological sites using geology","PhD in Geoarchaeology","Soil analysis, Stratigraphy","History, Earth science","Field excavation, Mineral collecting"
Hydrogeologist,"Researches groundwater systems","Master's in Hydrogeology","Aquifer modeling, Contamination analysis","Water resources, Science","Water quality testing, Caving"
Immunology Researcher,"Studies immune system functions","PhD in Immunology","Cell culture, Flow cytometry","Biology, Research","Medical journals, Science podcasts"
Jewelry Designer,"Creates wearable art pieces","Diploma in Jewelry Design","Metalworking, Gemology","Art, Design","Metal sculpting, Gem collecting"
Kinesiologist,"Studies human movement mechanics","Master's in Kinesiology","Biomechanics, Rehabilitation","Human movement, Sports","Personal training, Sports analysis"
Lighting Designer,"Plans illumination for spaces/events","Bachelor's in Lighting Design","Light plotting, Energy efficiency","Art, Technology","Photography, Energy conservation"
Museum Educator,"Develops educational programs","Master's in Museum Studies","Curriculum design, Public speaking","Education, Culture","Historical reenactment, Tour guiding"
Nuclear Medicine Technologist,"Uses radioactive materials for diagnosis","Associate's in Nuclear Medicine","Radiation safety, Imaging","Healthcare, Technology","Medical imaging, Safety protocols"
Ophthalmic Technician,"Assists with eye care","Certification program","Vision testing, Equipment maintenance","Healthcare, Precision","Optics experiments, Photography"
Petroleum Geologist,"Locates oil/natural gas deposits","Master's in Geology","Seismic interpretation, Reservoir analysis","Earth science, Exploration","Rock collecting, Field trips"
Quality Control Chemist,"Tests product quality","Bachelor's in Chemistry","Chemical analysis, Lab techniques","Quality, Science","Lab experiments, Quality auditing"
Robotics Ethicist,"Addresses moral implications of robotics","PhD in Ethics / PhD in Ethics Robotics","Ethical frameworks, Policy development","Technology, Philosophy","Robot ethics, Debate"
Sound Designer,"Creates audio for media","Bachelor's in Sound Design","Foley art, Audio editing","Audio engineering, Storytelling","Podcasting, Field recording"
Therapeutic Recreation Specialist,"Uses recreation for therapy","Bachelor's in Rec Therapy","Activity planning, Assessment","Wellness, Helping others","Adaptive sports, Community events"
Urban Farmer,"Practices agriculture in cities","Agriculture training","Hydroponics, Sustainable practices","Sustainability, Food","Community gardening, Cooking"
